{
  "filters": [],
  "format": "timeline-snapshot",
  "formatVersion": 1,
  "manifest": {
    "bundleId": "34fc2ee9-d357-5f34-8e46-dc61fc3ba62c",
    "completeness": "complete-for-declared-universe",
    "generation": "4ea83bdf-738a-547d-87ec-ebfc3b3c6408",
    "legacy": {
      "allRecordCount": 127,
      "readOnly": true,
      "status": "current"
    },
    "recordCount": 127,
    "revision": 1,
    "scope": {
      "sourceIds": [
        "ephemeris"
      ],
      "workspaceId": "default"
    },
    "snapshotAt": "2026-09-13T00:00:00.000Z",
    "sourceKind": "imported",
    "sourceName": "Ephemeris",
    "testDataset": {
      "id": "ephemeris",
      "reference": null,
      "referenceStatus": "unapproved-baseline"
    },
    "workspaceId": "default"
  },
  "models": [
    {
      "createdAt": "2026-09-13T00:00:00.000Z",
      "description": "",
      "draft": null,
      "id": "light",
      "lifecycle": "active",
      "name": "Ephemeris reference",
      "revision": 1,
      "tags": [],
      "updatedAt": "2026-09-13T00:00:00.000Z",
      "versions": [
        {
          "definition": {
            "bins": 128,
            "displayUnit": "HOUR",
            "fontSize": 11,
            "groupBy": "none",
            "presentation": {
              "bandLayout": [
                {
                  "height": 76,
                  "id": "main",
                  "role": "primary"
                },
                {
                  "height": 24,
                  "id": "overview",
                  "role": "overview"
                }
              ],
              "bands": {
                "overview": {
                  "backgroundColor": "#dddddd",
                  "intervalUnit": "YEAR"
                },
                "primary": {
                  "backgroundColor": "#eeeeee",
                  "barHeight": 6,
                  "dateColor": "#9099a0",
                  "intervalUnit": "HOUR",
                  "pointRadius": 4,
                  "textColor": "#121212"
                }
              },
              "compact": true,
              "labels": {
                "fontSize": 11,
                "maxLines": 1
              },
              "version": 1
            },
            "ratio": 4,
            "rowHeight": 32,
            "scaleMode": "uniform",
            "theme": "light",
            "timeZone": "UTC"
          },
          "publishedAt": "2026-09-13T00:00:00.000Z",
          "version": 1
        }
      ]
    },
    {
      "createdAt": "2026-09-13T00:00:00.000Z",
      "description": "",
      "draft": null,
      "id": "classic",
      "lifecycle": "active",
      "name": "Classic blue",
      "revision": 1,
      "tags": [],
      "updatedAt": "2026-09-13T00:00:00.000Z",
      "versions": [
        {
          "definition": {
            "bins": 128,
            "displayUnit": "HOUR",
            "fontSize": 11,
            "groupBy": "none",
            "ratio": 4,
            "rowHeight": 32,
            "scaleMode": "uniform",
            "theme": "classic",
            "timeZone": "UTC"
          },
          "publishedAt": "2026-09-13T00:00:00.000Z",
          "version": 1
        }
      ]
    },
    {
      "createdAt": "2026-09-13T00:00:00.000Z",
      "description": "",
      "draft": null,
      "id": "dark",
      "lifecycle": "active",
      "name": "Dark timeline",
      "revision": 1,
      "tags": [],
      "updatedAt": "2026-09-13T00:00:00.000Z",
      "versions": [
        {
          "definition": {
            "bins": 128,
            "displayUnit": "HOUR",
            "fontSize": 11,
            "groupBy": "none",
            "ratio": 4,
            "rowHeight": 32,
            "scaleMode": "uniform",
            "theme": "dark",
            "timeZone": "UTC"
          },
          "publishedAt": "2026-09-13T00:00:00.000Z",
          "version": 1
        }
      ]
    }
  ],
  "records": [
    {
      "createdAt": "2026-09-13T00:00:00.000Z",
      "createdBy": "fixture-converter",
      "data": {
        "description": ""
      },
      "deletedAt": null,
      "end": "2020-04-21T10:54:01.000Z",
      "extensions": {
        "sourceRecord": {
          "ID": "6f80f916-2fb8-4b6f-89dc-e35e286e2900",
          "data": {
            "satellite": "IS-21",
            "text": "Spacecraft: Intelsat IS-21 at 302.00 deg E / 58.00 deg W Atlantic Ocean Region   Longitude: +/- 0.015 deg Latitude:  +/- 0.015 deg 2020/04/21 02:04:51.150  Entering Polygon  [Center of Box] 2020/04/21 06:54:01.350  Exiting Polygon   [Center of Box] - Ref: https://my.intelsat.com/ephemeris/public#/",
            "title": "Ephemeris-0"
          },
          "end": "Tue Apr 21 06:54:01 EDT 2020",
          "start": "Tue Apr 21 02:04:51 EDT 2020"
        },
        "uncertainty": {}
      },
      "groupIds": [],
      "id": "35bbc9cf-7dac-53e9-9672-d2744f39ae5b",
      "kind": "session",
      "order": 0,
      "originalEnd": null,
      "originalStart": null,
      "parentSessionId": null,
      "render": {
        "color": "#658fe3"
      },
      "schemaId": null,
      "schemaVersion": null,
      "sourceId": "ephemeris",
      "start": "2020-04-21T06:04:51.000Z",
      "tags": [],
      "title": "Ephemeris-0",
      "updatedAt": "2026-09-13T00:00:00.000Z",
      "updatedBy": "fixture-converter",
      "version": 1,
      "workspaceId": "default"
    },
    {
      "createdAt": "2026-09-13T00:00:00.000Z",
      "createdBy": "fixture-converter",
      "data": {
        "description": ""
      },
      "deletedAt": null,
      "end": "2020-04-21T22:46:49.000Z",
      "extensions": {
        "sourceRecord": {
          "ID": "92a9473e-913e-4355-b760-03c70afd0da9",
          "data": {
            "satellite": "IS-21",
            "text": "Spacecraft: Intelsat IS-21 at 302.00 deg E / 58.00 deg W Atlantic Ocean Region   Longitude: +/- 0.015 deg Latitude:  +/- 0.015 deg 2020/04/21 13:52:04.350  Entering Polygon  [Center of Box] 2020/04/21 18:46:49.350  Exiting Polygon   [Center of Box] - Ref: https://my.intelsat.com/ephemeris/public#/",
            "title": "Ephemeris-1"
          },
          "end": "Tue Apr 21 18:46:49 EDT 2020",
          "start": "Tue Apr 21 13:52:04 EDT 2020"
        },
        "uncertainty": {}
      },
      "groupIds": [],
      "id": "962a505c-e8da-5e6e-8ff5-d98dcb35d164",
      "kind": "session",
      "order": 1,
      "originalEnd": null,
      "originalStart": null,
      "parentSessionId": null,
      "render": {
        "color": "#658fe3"
      },
      "schemaId": null,
      "schemaVersion": null,
      "sourceId": "ephemeris",
      "start": "2020-04-21T17:52:04.000Z",
      "tags": [],
      "title": "Ephemeris-1",
      "updatedAt": "2026-09-13T00:00:00.000Z",
      "updatedBy": "fixture-converter",
      "version": 1,
      "workspaceId": "default"
    },
    {
      "createdAt": "2026-09-13T00:00:00.000Z",
      "createdBy": "fixture-converter",
      "data": {
        "description": ""
      },
      "deletedAt": null,
      "end": "2020-04-22T10:55:35.000Z",
      "extensions": {
        "sourceRecord": {
          "ID": "f04d3479-0447-46f2-926e-d303cba35bb1",
          "data": {
            "satellite": "IS-21",
            "text": "Spacecraft: Intelsat IS-21 at 302.00 deg E / 58.00 deg W Atlantic Ocean Region   Longitude: +/- 0.015 deg Latitude:  +/- 0.015 deg 2020/04/22 00:59:22.650  Entering Polygon  [Center of Box] 2020/04/22 06:55:35.850  Exiting Polygon   [Center of Box] - Ref: https://my.intelsat.com/ephemeris/public#/",
            "title": "Ephemeris-2"
          },
          "end": "Wed Apr 22 06:55:35 EDT 2020",
          "start": "Wed Apr 22 00:59:22 EDT 2020"
        },
        "uncertainty": {}
      },
      "groupIds": [],
      "id": "5b97f1b0-d061-5735-8868-014f3d646738",
      "kind": "session",
      "order": 2,
      "originalEnd": null,
      "originalStart": null,
      "parentSessionId": null,
      "render": {
        "color": "#658fe3"
      },
      "schemaId": null,
      "schemaVersion": null,
      "sourceId": "ephemeris",
      "start": "2020-04-22T04:59:22.000Z",
      "tags": [],
      "title": "Ephemeris-2",
      "updatedAt": "2026-09-13T00:00:00.000Z",
      "updatedBy": "fixture-converter",
      "version": 1,
      "workspaceId": "default"
    },
    {
      "createdAt": "2026-09-13T00:00:00.000Z",
      "createdBy": "fixture-converter",
      "data": {
        "description": ""
      },
      "deletedAt": null,
      "end": "2020-04-22T23:21:33.000Z",
      "extensions": {
        "sourceRecord": {
          "ID": "faccffa6-bdb4-4524-8025-4dcddee321ba",
          "data": {
            "satellite": "IS-21",
            "text": "Spacecraft: Intelsat IS-21 at 302.00 deg E / 58.00 deg W Atlantic Ocean Region   Longitude: +/- 0.015 deg Latitude:  +/- 0.015 deg 2020/04/22 14:33:04.050  Entering Polygon  [Center of Box] 2020/04/22 19:21:33.749  Exiting Polygon   [Center of Box] - Ref: https://my.intelsat.com/ephemeris/public#/",
            "title": "Ephemeris-3"
          },
          "end": "Wed Apr 22 19:21:33 EDT 2020",
          "start": "Wed Apr 22 14:33:04 EDT 2020"
        },
        "uncertainty": {}
      },
      "groupIds": [],
      "id": "31049820-0529-5c6a-887b-b90ffabb6ed3",
      "kind": "session",
      "order": 3,
      "originalEnd": null,
      "originalStart": null,
      "parentSessionId": null,
      "render": {
        "color": "#658fe3"
      },
      "schemaId": null,
      "schemaVersion": null,
      "sourceId": "ephemeris",
      "start": "2020-04-22T18:33:04.000Z",
      "tags": [],
      "title": "Ephemeris-3",
      "updatedAt": "2026-09-13T00:00:00.000Z",
      "updatedBy": "fixture-converter",
      "version": 1,
      "workspaceId": "default"
    },
    {
      "createdAt": "2026-09-13T00:00:00.000Z",
      "createdBy": "fixture-converter",
      "data": {
        "description": ""
      },
      "deletedAt": null,
      "end": "2020-04-23T10:13:12.000Z",